[
  {
    "Id": "node",
    "Name": "Node.js",
    "Categories": [
      "Development"
    ],
    "Glyph": "JS",
    "Color": "#78B94B",
    "Homepage": "https://nodejs.org",
    "Description": "JavaScript runtime built on Chrome’s V8 engine.",
    "Enabled": true,
    "Source": "node",
    "InstallerType": "msi",
    "SilentArguments": "/qn /norestart",
    "RegistryPattern": "^Node\\.js$",
    "DownloadHosts": [
      "nodejs.org"
    ],
    "Publisher": "OpenJS Foundation",
    "RequireSignature": true,
    "VerificationCommands": [
      {
        "FilePath": "%ProgramFiles%\\nodejs\\node.exe",
        "Arguments": [
          "--version"
        ],
        "CompareVersion": true,
        "RelativePath": "node.exe"
      },
      {
        "FilePath": "%ProgramFiles%\\nodejs\\node.exe",
        "Arguments": [
          "{ExecutableDirectory}\\node_modules\\npm\\bin\\npm-cli.js",
          "--version"
        ],
        "RelativePath": "node.exe"
      }
    ],
    "DependencyStatus": "Verified",
    "DependencyNotes": "No separately installed application from this catalog is required. Installer includes its runtime components.",
    "RequirementSources": [
      "https://nodejs.org/en/download"
    ],
    "InstallationNotes": "Uses documented vendor installation defaults.",
    "DiscoveryPatterns": [
      "node*",
      "OpenJS.NodeJS*"
    ],
    "DiscoveryExecutable": "node.exe"
  },
  {
    "Id": "git",
    "Name": "Git",
    "Categories": [
      "Development"
    ],
    "Glyph": "◆",
    "Color": "#F4664A",
    "Homepage": "https://gitforwindows.org",
    "Description": "Distributed version control with Git Bash.",
    "Enabled": true,
    "Source": "github",
    "Repository": "git-for-windows/git",
    "AssetPattern": "^Git-[\\d.]+-64-bit\\.exe$",
    "SilentArguments": "/VERYSILENT /NORESTART /NOCANCEL /SP-",
    "RegistryPattern": "^Git( version.*)?$",
    "DownloadHosts": [
      "github.com",
      "release-assets.githubusercontent.com",
      "objects.githubusercontent.com"
    ],
    "Publisher": "Johannes Schindelin",
    "RequireSignature": true,
    "VerificationCommands": [
      {
        "FilePath": "%ProgramFiles%\\Git\\cmd\\git.exe",
        "Arguments": [
          "--version"
        ],
        "CompareVersion": true,
        "RelativePath": "cmd/git.exe"
      }
    ],
    "DependencyStatus": "Verified",
    "DependencyNotes": "No separately installed application from this catalog is required. Installer includes its runtime components.",
    "RequirementSources": [
      "https://gitforwindows.org/silent-or-unattended-installation"
    ],
    "InstallationNotes": "Uses documented vendor installation defaults.",
    "DiscoveryPatterns": [
      "Git",
      "PortableGit*",
      "Git.Git*"
    ],
    "DiscoveryExecutable": "cmd/git.exe"
  },
  {
    "Id": "java",
    "Name": "Java (JDK)",
    "Categories": [
      "Development"
    ],
    "Glyph": "♨",
    "Color": "#E99850",
    "Homepage": "https://adoptium.net",
    "Description": "OpenJDK runtime and development tools.",
    "Enabled": true,
    "DependencyStatus": "Verified",
    "DependencyNotes": "No separately installed application from this catalog is required. Installer includes its runtime components.",
    "RequirementSources": [
      "https://adoptium.net/installation/windows/"
    ],
    "InstallationNotes": "Machine-wide Temurin JDK; vendor INSTALLLEVEL=1 configures PATH. JAVA_HOME is not overwritten.",
    "Source": "adoptium",
    "InstallerType": "msi",
    "SilentArguments": "/qn /norestart INSTALLLEVEL=1",
    "RegistryPattern": "^(?:Eclipse Temurin.*JDK|Java.*Development Kit|OpenJDK.*|Microsoft Build of OpenJDK).*",
    "DownloadHosts": [
      "github.com",
      "release-assets.githubusercontent.com",
      "objects.githubusercontent.com"
    ],
    "RequireSignature": true,
    "Publisher": "Eclipse Foundation",
    "VerificationCommands": [
      {
        "FilePath": "%ProgramFiles%\\Eclipse Adoptium\\jdk-*\\bin\\java.exe",
        "Arguments": [
          "--version"
        ],
        "CompareVersion": true,
        "RelativePath": "bin/java.exe"
      },
      {
        "FilePath": "%ProgramFiles%\\Eclipse Adoptium\\jdk-*\\bin\\javac.exe",
        "Arguments": [
          "--version"
        ],
        "CompareVersion": true,
        "RelativePath": "bin/javac.exe"
      }
    ],
    "DiscoveryPatterns": [
      "java",
      "jdk*",
      "openjdk*",
      "temurin*",
      "Eclipse Adoptium",
      "zulu*",
      "corretto*",
      "Microsoft"
    ],
    "DiscoveryExecutable": "bin/java.exe"
  },
  {
    "Id": "python",
    "Name": "Python",
    "Categories": [
      "Development"
    ],
    "Glyph": "Py",
    "Color": "#E6C759",
    "Homepage": "https://www.python.org",
    "Description": "Python language and package ecosystem.",
    "Enabled": true,
    "DependencyStatus": "Verified",
    "DependencyNotes": "No separately installed application from this catalog is required. Installer includes its runtime components.",
    "RequirementSources": [
      "https://docs.python.org/3/using/windows.html",
      "https://www.python.org/downloads/windows/"
    ],
    "InstallationNotes": "Official Windows x64 full installer; installs for all users and adds Python to PATH.",
    "Source": "python",
    "InstallerType": "exe",
    "SilentArguments": "/quiet InstallAllUsers=1 PrependPath=1 Include_test=0",
    "RegistryPattern": "^Python \\d+\\.\\d+(?:\\.\\d+)? \\(64-bit\\)$",
    "DownloadHosts": [
      "www.python.org",
      "python.org"
    ],
    "RequireSignature": true,
    "Publisher": "Python Software Foundation",
    "VerificationCommands": [
      {
        "FilePath": "%ProgramFiles%\\Python*\\python.exe",
        "Arguments": [
          "--version"
        ],
        "CompareVersion": true,
        "RelativePath": "python.exe"
      }
    ],
    "DiscoveryPatterns": [
      "Python*"
    ],
    "DiscoveryExecutable": "python.exe"
  },
  {
    "Id": "hermes",
    "Name": "Hermes Agent Desktop",
    "Categories": [
      "AI & LLM"
    ],
    "Glyph": "H",
    "Color": "#ADB5C5",
    "Homepage": "https://hermes-agent.nousresearch.com/docs/user-guide/desktop",
    "Description": "Desktop interface for Hermes Agent.",
    "Enabled": true,
    "DependencyStatus": "Verified",
    "DependencyNotes": "Official desktop bootstrap manages its own Git, Python, Node.js, npm and other runtime dependencies. They are not separate system-app prerequisites. Optional integrations may need extra tools.",
    "RequirementSources": [
      "https://hermes-agent.nousresearch.com/desktop",
      "https://hermes-agent.nousresearch.com/docs/user-guide/windows-native"
    ],
    "InstallationNotes": "Signed official desktop bootstrap. Follow the vendor setup window; it prepares its managed runtime and builds Desktop. Network access is required.",
    "Source": "hermes",
    "InstallerType": "exe",
    "Interactive": true,
    "RequiresAdministrator": false,
    "RequireSignature": true,
    "Publisher": "Nous Research",
    "DownloadHosts": [
      "hermes-assets.nousresearch.com"
    ],
    "Repository": "NousResearch/hermes-agent",
    "RegistryPattern": "^Hermes(?: Agent)?(?: Desktop)?$",
    "DiscoveryPatterns": [
      "Hermes*"
    ],
    "DiscoveryExecutable": "Hermes.exe"
  },
  {
    "Id": "lmstudio",
    "Name": "LM Studio",
    "Categories": [
      "AI & LLM"
    ],
    "Glyph": "≋",
    "Color": "#A177FF",
    "Homepage": "https://lmstudio.ai",
    "Description": "Discover and run local language models.",
    "Enabled": true,
    "DependencyStatus": "Verified",
    "DependencyNotes": "No separate Node.js, Python, Java or Docker installation is required. Local inference depends on supported CPU/GPU and available RAM; model downloads are separate.",
    "RequirementSources": [
      "https://lmstudio.ai/download",
      "https://lmstudio.ai/docs/app/system-requirements"
    ],
    "InstallationNotes": "Official signed installer. Follow the vendor setup window; no undocumented silent switches are used.",
    "Source": "redirect",
    "FeedUrl": "https://lmstudio.ai/download/latest/win32/x64",
    "AssetPattern": "LM-Studio-([0-9.]+(?:-[0-9]+)?)-x64\\.exe",
    "RegistryPattern": "^LM Studio(?: [0-9].*)?$",
    "InstallerType": "exe",
    "Interactive": true,
    "RequiresAdministrator": false,
    "RequireSignature": true,
    "Publisher": "Element Labs",
    "DownloadHosts": [
      "lmstudio.ai",
      "installers.lmstudio.ai"
    ],
    "DiscoveryPatterns": [
      "LM Studio*",
      "LM-Studio*",
      "ElementLabs.LMStudio*"
    ],
    "DiscoveryExecutable": "LM Studio.exe"
  },
  {
    "Id": "bionic",
    "Name": "LM Studio Bionic",
    "Categories": [
      "AI & LLM"
    ],
    "Glyph": "⬡",
    "Color": "#9861E9",
    "Homepage": "https://lmstudio.ai/download?os=windows",
    "Description": "LM Studio Bionic desktop application; listed on the official LM Studio download page.",
    "Enabled": true,
    "DependencyStatus": "Verified",
    "DependencyNotes": "Runs its own local models, cloud models or remote models. A separate LM Studio installation is not required. Local models need suitable hardware and a model download.",
    "RequirementSources": [
      "https://lmstudio.ai/download",
      "https://lmstudio.ai/docs/bionic/models"
    ],
    "InstallationNotes": "Official signed installer. Follow the vendor setup window; no undocumented silent switches are used.",
    "Source": "redirect",
    "FeedUrl": "https://lmstudio.ai/download/bionic/latest/win32/x64",
    "AssetPattern": "Bionic-([0-9.]+(?:-[0-9]+)?)-x64\\.exe",
    "RegistryPattern": "^(?:LM Studio )?Bionic(?: [0-9].*)?$",
    "InstallerType": "exe",
    "Interactive": true,
    "RequiresAdministrator": false,
    "RequireSignature": true,
    "Publisher": "Element Labs",
    "DownloadHosts": [
      "lmstudio.ai",
      "bionic-installers.lmstudio.ai"
    ],
    "DiscoveryPatterns": [
      "Bionic*",
      "LM Studio Bionic*"
    ],